{
  "schema": 5,
  "identity": ["lang", "best-practice", "task", "state-machine"],
  "version": "v0.1",
  "status": {
    "kind": "proposed",
    "since_language_version": null,
    "explanation": null,
    "replacement": null
  },
  "class": "recommended",
  "title": "Model event-driven state machines as tasks",
  "summary": "A task naturally owns state and serializes the messages which represent its events.",
  "recommendation": "Start an event-driven state machine as a task whose accepted messages describe events and whose private value describes the current state.",
  "rationale": "Task isolation makes event ordering and state ownership explicit while keeping transitions close to the messages which trigger them.",
  "language": "topal",
  "language_versions": ">=v0.1",
  "required_features": ["task", "message"],
  "excluded_features": [],
  "default_enabled": false,
  "default_severity": "warning",
  "checkability": "heuristic",
  "rectification": "suggestion",
  "tags": [
    ["lang", "best-practice", "tag", "architecture"],
    ["lang", "best-practice", "tag", "concurrency"],
    ["lang", "best-practice", "tag", "readability"]
  ],
  "exceptions": [
    "Prefer a pure transition function when no persistent task identity, asynchronous event source, or isolated mutable state is required."
  ],
  "examples": [
    "examples/language/task-message-transactions.t",
    "examples/linter/task-state-machine-rule.t"
  ],
  "specification_rules": ["TOPAL-TASK-MESSAGE-001", "TOPAL-TASK-STATE-001"],
  "lint_rule": {
    "engine": "topal",
    "entry_point": "rule",
    "version": "v0.1",
    "stage": "syntax",
    "view": "task-state-machine/1",
    "diagnostic_code": "L-TASK-STATE-MACHINE",
    "source": "examples/linter/task-state-machine-rule.t"
  },
  "provenance": "Topal design discussion approved 2026-08-16",
  "license": "MIT"
}
